{
  "event_id": "roadmap_3_0_a_strategic_business_workforce_model_platform_requirements_capture_learning_event",
  "schema_version": "gokv.learning_event.v1",
  "source_prompt": "PROMPT ROADMAP 3.0.A",
  "source_phase": "ROADMAP_3_0_A_STRATEGIC_REQUIREMENTS_CAPTURE",
  "source_checkpoint": "ROADMAP_3_0_A_N7_CHECKPOINT_PASSED",
  "start_commit": "ba3f091449cd9fd736ec58981d0e41aa3c5d66eb",
  "end_commit": null,
  "model": "GPT-5.6 Luna",
  "effort": "Muy Alto",
  "mission_type": "strategic_business_workforce_model_platform_requirements_capture",
  "planned_stations": 8,
  "completed_stations": 8,
  "commits": [],
  "tests": ["tests/test_roadmap_3_0_a_strategic_requirements_capture.py"],
  "duration": null,
  "operator_interventions": [],
  "retries": 0,
  "rollbacks": 0,
  "autonomous_blockers_resolved": ["strategic_document_duplication","current_vs_future_ambiguity","closed_taxonomy_interpretation"],
  "result": "ROADMAP_3_0_A_STRATEGIC_BUSINESS_WORKFORCE_MODEL_REQUIREMENTS_CAPTURE_PASSED",
  "observations": [
    "The existing professional library is initial critical mass and not an architectural ceiling.",
    "Agent readiness requires capability, memory, model, permission and organization evidence beyond JSON existence.",
    "Hardware constraints should change concurrency and scheduling before professional quality.",
    "The workforce readiness gate is future and depends on 3.x, 4.x and 5.x evidence.",
    "No new candidate knowledge was stored because this block captured strategic requirements rather than a validated operational rule."
  ],
  "candidate_knowledge_ids": [],
  "metrics_refs": ["roadmap_3_0_a_strategic_requirements_execution_metric"],
  "created_at": "2026-09-08T23:59:00Z"
}
