{
  "event_id": "roadmap_3_0_backend_elite_read_only_audit_learning_event",
  "schema_version": "gokv.learning_event.v1",
  "source_prompt": "PROMPT ROADMAP 3.0",
  "source_phase": "ROADMAP_3_0_BACKEND_ELITE_READ_ONLY_AUDIT",
  "source_checkpoint": "ROADMAP_3_0_N9_CHECKPOINT_HANDOFF_PASSED",
  "start_commit": "82d309f00ab99dfa9eb100e5594bf1d8d0559f5a",
  "end_commit": null,
  "model": "GPT-5.6 Luna",
  "effort": "Muy Alto",
  "mission_type": "backend_elite_read_only_audit",
  "planned_stations": 10,
  "completed_stations": 10,
  "commits": ["249bca62","a79aeca3","620d3214","f3146972","9d7a7f54","54c2ccb9","bd06985b","c5c36e2e","e3b31e79","4ad33f32","879d185a"],
  "tests": [
    "tests/test_roadmap_3_0_n0_backend_surface_census.py",
    "tests/test_roadmap_3_0_n1_api_routing_contract_graph.py",
    "tests/test_roadmap_3_0_n2_persistence_side_effect_graph.py",
    "tests/test_roadmap_3_0_n3_runtime_execution_graph.py",
    "tests/test_roadmap_3_0_n4_provider_network_credential_graph.py",
    "tests/test_roadmap_3_0_n5_agent_preset_paper_team_activation_graph.py",
    "tests/test_roadmap_3_0_n6_security_permission_trust_boundary_graph.py",
    "tests/test_roadmap_3_0_n7_backend_cross_layer_risk_unknown_matrix.py",
    "tests/test_roadmap_3_0_n8_backend_elite_audit_synthesis.py"
  ],
  "duration": null,
  "operator_interventions": [],
  "retries": 0,
  "rollbacks": 0,
  "autonomous_blockers_resolved": ["backend_surface_ambiguity","legacy_vs_contract_runtime_ambiguity","provider_and_security_frontier_ambiguity"],
  "result": "ROADMAP_3_0_BACKEND_ELITE_READ_ONLY_AUDIT_PASSED",
  "observations": [
    "The repository contains a legacy callable API/application path and a separate disabled or contractual 3.x runtime plane.",
    "The static scan found 60 write/side-effect candidates, 9 network-capable references and 13 dangerous primitive calls; none were invoked.",
    "The provider path and settings secret-write candidate make security and activation the next natural read-only block.",
    "No new knowledge candidate was found and no promotion was performed."
  ],
  "candidate_knowledge_ids": [],
  "metrics_refs": ["roadmap_3_0_backend_elite_read_only_audit_execution_metric"],
  "created_at": "2026-09-08T23:12:47Z"
}
