{
  "autonomous_blockers_resolved": [
    "continuity_rebase_from_closed_ui_ux_1_204",
    "historical_method_and_current_state_ambiguity"
  ],
  "candidate_knowledge_ids": [],
  "commits": [
    "ca34823",
    "d05f7fe",
    "e31fd0e",
    "06a4c04",
    "e388863",
    "e091d3b",
    "442cb97",
    "45f741e"
  ],
  "completed_stations": 4,
  "created_at": "2026-09-08T22:23:20Z",
  "duration": null,
  "effort": "Muy Alto",
  "end_commit": null,
  "event_id": "roadmap_2_x_continuity_rebase_learning_event",
  "metrics_refs": [
    "roadmap_2_x_continuity_rebase_execution_metric"
  ],
  "mission_type": "roadmap_2_x_continuity_rebase_after_ui_ux_current_line_closure",
  "model": "GPT-5.6 Luna",
  "observations": [
    "N0-N3 completed as documentary, read-only, test and knowledge stations with no product change.",
    "The UI/UX 1.204 line remained closed at eb00a478 and the product baseline c2794799 remained empty throughout Roadmap 2.x.",
    "The stale README cursor was resolved with a minimal current-cursor section; historical 1.204 capture hashes were preserved as historical-only evidence.",
    "PROMOTED_ONLY was sufficient for the continuity rebase and the next 3.0 mission handoff; validated and candidate items were not selected.",
    "The current-state map distinguishes source existence from activation and records the backend frontier as read-only inventory first.",
    "The self-contained report is evidence for conditioned autonomy remaining VALIDATED and NOT_PROMOTED; no new knowledge candidate was found."
  ],
  "operator_interventions": [],
  "planned_stations": 4,
  "result": "ROADMAP_2_X_CONTINUITY_REBASE_PASSED",
  "retries": 0,
  "rollbacks": 0,
  "schema_version": "gokv.learning_event.v1",
  "source_checkpoint": "ROADMAP_2_X",
  "source_phase": "ROADMAP_2_X_CONTINUITY_REBASE",
  "source_prompt": "PROMPT ROADMAP 2.x",
  "start_commit": "eb00a478",
  "tests": [
    "tests/test_roadmap_2_0_continuity_preflight.py",
    "tests/test_roadmap_2_1_method_applied_audit.py",
    "tests/test_roadmap_2_2_current_state_map.py",
    "tests/test_roadmap_2_3_continuity_rebase_checkpoint.py",
    "tests/test_roadmap_2_x_post_block_capture.py"
  ]
}
