{
  "event_id": "roadmap_3_x_macro_02_1_learning_reconciliation",
  "schema_version": "gokv.learning_event.v1",
  "source_prompt": "PROMPT IA_CORE ROADMAP 3.x MACRO-MISSION 02.1 HERMETIC VALIDATION + PHANTOM SIDE-EFFECT CONTAINMENT + COMMIT ACCOUNTABILITY + LEARNING RECONCILIATION",
  "source_phase": "MACRO_02_1_LEARNING_RECONCILIATION",
  "source_checkpoint": "ROADMAP_3_X_MACRO_02_B4_B5_PASSED_B6_CONDITIONALLY_DEFERRED_AND_PUBLISHED",
  "start_commit": "ad7a3dcac1959aba086c1098b126e8c97b9e32b8",
  "end_commit": "d95ffba",
  "model": "GPT-5.6 Luna",
  "effort": "Muy Alto",
  "mission_type": "roadmap_3_x_macro_02_1_hermetic_validation",
  "planned_stations": 7,
  "completed_stations": 5,
  "commits": ["9747ebb", "e2eedb8", "effdcd2", "d95ffba"],
  "tests": ["tests/test_roadmap_3_x_macro_02_1_hermetic_validation.py", "tests/test_roadmap_3_x_macro_02_1_phantom_side_effects.py", "tests/test_roadmap_3_x_macro_02_1_legacy_alignment.py"],
  "duration": null,
  "operator_interventions": [],
  "retries": 0,
  "rollbacks": 0,
  "autonomous_blockers_resolved": ["legacy collection egress", "phantom repository writes", "historical HTML assertion drift", "Macro 02 NO_LEARNING_FOUND reconciliation"],
  "result": "RECONCILIATION_COMPLETED_WITH_THREE_CANDIDATES_AND_FOUR_REUSED_KNOWLEDGE_ITEMS",
  "observations": ["Collection can execute provider work before a fixture runs when a root test has top-level statements.", "Restoring tracked files after tests does not establish no side effects.", "Macro 02's 20-commit range includes bounded repair commits that require individual verdicts.", "Existing focal, rollback, and station-commit knowledge was reused; exact hermeticity and repair-parity gaps became candidates.", "No candidate was promoted automatically."],
  "candidate_knowledge_ids": ["test_collection_must_be_side_effect_free", "test_writes_require_temporary_boundary", "commit_repair_needs_explicit_parity"],
  "metrics_refs": ["roadmap_3_x_macro_02_1_learning_reconciliation_metric"],
  "created_at": "2026-09-11T00:00:00+00:00"
}
