{
  "autonomous_blockers_resolved": [],
  "candidate_knowledge_ids": ["callable_chain_is_not_authorized_route", "contract_exists_is_not_route_adapter", "derive_service_owner_before_destination", "legacy_write_needs_boundary_proof", "partial_security_fix_does_not_assign_owner", "read_only_method_is_not_read_authz"],
  "commits": ["be5986e0f8fd49a61694d2d8752bae20f0f52c52", "678910e119304cdc9cbbcd71ca0e72560c0f538d", "5fb046934ab764020b23dcf9a883b0e3a6896502", "fbbc5372865467c4c5de3c09e580644971e2d163"],
  "completed_stations": 4,
  "created_at": "2026-09-11T00:00:00+00:00",
  "duration": null,
  "effort": "Muy Alto",
  "end_commit": "fbbc5372865467c4c5de3c09e580644971e2d163",
  "event_id": "roadmap_3_x_macro_01_learning_adjudication",
  "metrics_refs": ["roadmap_3_x_macro_01_learning_adjudication_metric"],
  "mission_type": "roadmap_3_x_macro_01_learning_adjudication",
  "model": "GPT-5.6 Luna",
  "observations": ["Six Macro 01 observations were recovered with source evidence and generality analysis.", "All six remain CANDIDATE because the current evidence is development-origin and single-mission.", "No automatic promotion was performed.", "Conflicts and duplicates were checked against the current vault vocabulary.", "The next governed station may consume only PROMOTED or explicitly DEVELOPMENT_VALIDATED knowledge."],
  "operator_interventions": [],
  "planned_stations": 4,
  "retries": 0,
  "result": "ROADMAP_3_X_MACRO_01_LEARNING_ADJUDICATED_CANDIDATE_ONLY",
  "rollbacks": 0,
  "schema_version": "gokv.learning_event.v1",
  "source_checkpoint": "ROADMAP_3_X_MACRO_01",
  "source_phase": "MACRO_01_LEARNING_ADJUDICATION",
  "source_prompt": "PROMPT ROADMAP 3.x MACRO-MISSION 01",
  "start_commit": "be5986e0f8fd49a61694d2d8752bae20f0f52c52",
  "tests": ["tests/test_roadmap_3_x_macro_01_security_legacy_canonical_alignment.py", "tests/test_roadmap_3_x_macro_02_learning_adjudication.py" ]
}
