{
  "autonomous_blockers_resolved": [],
  "candidate_knowledge_ids": [],
  "commits": ["eb3a02f72be320a75d5a7501f2c059dba8e0c548", "1c07393b21cd3b4965e956da519ddfa71ce3eaf3", "975a54e5624512450903d9b94c380cbe57bad0f0", "c520d2a072c1435118113f7411fd862b008d3194", "6622289f09e8af28845427d0984706267cdfc6c6", "75b0d1eed5b169bc8bdfe35d3f5b67f37b2778c3", "1fdf1c444a5985c01658d6125377a0835849491e", "888527c0a2d58198e10df80d1ccc90673c1692e9", "a6af100df13665efefedf81388da1ebe177e5480", "588aeaaf99fda6e0c84174be753b8dc11d09e548", "b1b15e0605fe5efe4fbdc9dd2123f3d43199dc9d", "c258700a894fdb7a7962b89ed57b165ca799d3b0", "378ebd557f3191675b8708a77461f187ccaa3330", "74f1a366e954dbc041c10c0ee17d65e041bb1421", "24b0fecc23148c325a3f5577559e689c6e1872e9", "61a0eab30e88f06254c66adc7ca5de8d744e09e8"],
  "completed_stations": 10,
  "created_at": "2026-09-11T00:00:00+00:00",
  "duration": null,
  "effort": "Muy Alto",
  "end_commit": "61a0eab30e88f06254c66adc7ca5de8d744e09e8",
  "event_id": "roadmap_3_x_macro_02_learning_loop",
  "metrics_refs": ["roadmap_3_x_macro_02_learning_loop_metric"],
  "mission_type": "roadmap_3_x_macro_02_method_3_2_governed_readiness",
  "model": "GPT-5.6 Luna",
  "observations": ["The explicit OCI resource budget made relevant omissions auditable without changing default historical packs.", "B4 and B5 contracts improved static readiness evidence but did not prove legacy route coverage or contractual ownership.", "All 36 routes correctly remained UNKNOWN after convergence.", "Loteria capability extraction found domain-specific families and two adapter candidates without movement.", "B6 internal workforce readiness is contract-only and has no active workforce.", "No new distinct candidate is stored; these observations refine existing boundaries and remain preserved in this event."],
  "operator_interventions": [],
  "planned_stations": 10,
  "retries": 0,
  "result": "ROADMAP_3_X_MACRO_02_REFINEMENT_CAPTURED_NO_NEW_CANDIDATE",
  "rollbacks": 0,
  "schema_version": "gokv.learning_event.v1",
  "source_checkpoint": "ROADMAP_3_X_MACRO_02_PRE_INTEGRAL_CHECKPOINT",
  "source_phase": "MACRO_02_LEARNING_LOOP",
  "source_prompt": "PROMPT IA_CORE ROADMAP 3.x MACRO-MISSION 02",
  "start_commit": "eb3a02f72be320a75d5a7501f2c059dba8e0c548",
  "tests": ["tests/test_method_santi_3_2.py", "tests/test_gokv_oci_resource_governance_0_4.py", "tests/test_roadmap_3_x_macro_02_learning_adjudication.py", "tests/test_roadmap_3_x_macro_02_b4_a_permission_activation_boundary.py", "tests/test_roadmap_3_x_macro_02_b4_b_provider_network_credential_boundary.py", "tests/test_roadmap_3_x_macro_02_b5_a_persistence_ownership_retention.py", "tests/test_roadmap_3_x_macro_02_b5_b_sandbox_recovery_rollback.py", "tests/test_roadmap_3_x_macro_02_route_convergence.py", "tests/test_roadmap_3_x_macro_02_loteria_p3_capability_extraction.py", "tests/test_roadmap_3_x_macro_02_b6_workforce_readiness_contract.py"]
}
