{
  "autonomous_blockers_resolved": [],
  "candidate_knowledge_ids": [],
  "commits": [
    "9387370"
  ],
  "completed_stations": 1,
  "created_at": "2026-09-08T14:57:03.567532+00:00",
  "duration": null,
  "effort": "Muy Alto (prompt-declared target)",
  "end_commit": "9387370",
  "event_id": "gokv_0_2_n6_shadow_learning_event",
  "metrics_refs": [
    "gokv_0_2_n6_shadow_metric"
  ],
  "mission_type": "microcopy_direction_decision_execution_preparation",
  "model": "GPT-5.6 Luna (prompt-declared target)",
  "observations": [
    "Shadow inspection produced no candidate, conflict, or measured helpfulness result.",
    "UI/UX 1.200 was not executed."
  ],
  "operator_interventions": [],
  "planned_stations": 1,
  "result": "NO_LEARNING_FOUND",
  "retries": 0,
  "rollbacks": 0,
  "schema_version": "gokv.learning_event.v1",
  "source_checkpoint": "N6_GOKV_SHADOW_INHERITANCE_EVALUATION_PASSED",
  "source_phase": "GOKV_0_2_N6_SHADOW",
  "source_prompt": "GOKV 0.2 N6 shadow inheritance",
  "start_commit": "ac30d2f",
  "tests": [
    "tests/test_gokv_shadow_inheritance_0_2.py"
  ]
}
